{
    "name": "simplify",
    "description": "Analyze source code complexity and get AI fix instructions for the most complex files. This tool runs ahma-simplify to identify files with high cognitive/cyclomatic complexity, low maintainability, or excessive size, then returns a detailed report with per-function hotspots and actionable refactoring instructions. Always pass ai_fix set to the issue number you want to fix (1 = most complex file). The report identifies specific hotspot functions within each file. The structured prompt instructs you to focus changes on those hotspots only.",
    "command": "ahma-simplify",
    "enabled": true,
    "timeout_seconds": 600,
    "synchronous": true,
    "subcommand": [
        {
            "name": "default",
            "description": "Run code simplicity analysis and return fix instructions for the Nth most complex file. Set ai_fix to the issue number (1 = worst file).",
            "positional_args": [
                {
                    "name": "directory",
                    "type": "string",
                    "description": "Directory to analyze (absolute or relative path to the project root)",
                    "format": "path",
                    "required": true
                }
            ],
            "options": [
                {
                    "name": "working_directory",
                    "type": "string",
                    "description": "Working directory for command execution",
                    "format": "path"
                },
                {
                    "name": "ai-fix",
                    "type": "integer",
                    "description": "Issue number to generate AI fix instructions for (1 = most complex file, 2 = second most complex, etc.). When set, outputs the full report plus a structured prompt to simplify that file."
                },
                {
                    "name": "limit",
                    "alias": "l",
                    "type": "integer",
                    "description": "Number of top complexity issues to include in the report (default: 10)"
                },
                {
                    "name": "html",
                    "type": "boolean",
                    "description": "Generate HTML report and open it automatically (shorthand for --html and --open combined)"
                },
                {
                    "name": "extensions",
                    "alias": "e",
                    "type": "array",
                    "description": "File extensions to analyze as comma-separated values (e.g. rs,py,js). Supported: rs, py, js, ts, tsx, c, h, cpp, cc, hpp, hh, cs, java, go, css, html. Default: all supported extensions",
                    "items": {
                        "type": "string"
                    }
                },
                {
                    "name": "exclude",
                    "alias": "x",
                    "type": "array",
                    "description": "Additional paths/patterns to exclude, comma-separated (e.g. **/generated/**,**/vendor/**)",
                    "items": {
                        "type": "string"
                    }
                },
                {
                    "name": "verify",
                    "type": "string",
                    "description": "Re-analyze a specific file and compare against the previous analysis baseline. Shows before/after metrics with relative improvement percentages. Requires a prior full analysis run.",
                    "format": "path"
                }
            ],
            "synchronous": true
        }
    ],
    "availability_check": {
        "command": "ahma-simplify",
        "args": [
            "--version"
        ],
        "skip_subcommand_args": true
    },
    "install_instructions": "Build with: cargo build -p ahma_simplify --release && cargo install --path ahma_simplify"
}